ex_id,name,category,difficulty_level,duration_sec,contraindications,gifUrl,bodyPart,secondaryMuscles,instructions
1,3/4 sit-up,근력,1,20,abs,https://v2.exercisedb.io/image/MOnK4iG0MEt9h8,waist,,"Lie flat on your back with your knees bent and feet flat on the ground. Place your hands behind your head with your elbows pointing outwards. Engaging your abs, slowly lift your upper body off the ground, curling forward until your torso is at a 45-degree angle. Pause for a moment at the top, then slowly lower your upper body back down to the starting position. Repeat for the desired number of repetitions."
2,45° side bend,근력,2,20,abs,https://v2.exercisedb.io/image/PERWLDGUxVbpHS,waist,,"Stand with your feet shoulder-width apart and your arms extended straight down by your sides. Keeping your back straight and your core engaged, slowly bend your torso to one side, lowering your hand towards your knee. Pause for a moment at the bottom, then slowly return to the starting position. Repeat on the other side. Continue alternating sides for the desired number of repetitions."
3,air bike,근력,1,20,abs,https://v2.exercisedb.io/image/PLr4yo3j-f1amp,waist,,"Lie flat on your back with your hands placed behind your head. Lift your legs off the ground and bend your knees at a 90-degree angle. Bring your right elbow towards your left knee while simultaneously straightening your right leg. Return to the starting position and repeat the movement on the opposite side, bringing your left elbow towards your right knee while straightening your left leg. Continue alternating sides in a pedaling motion for the desired number of repetitions."
4,all fours squad stretch,스트레칭,1,20,quads,https://v2.exercisedb.io/image/XPQwM7HECjgNFE,upper legs,,"Start on all fours with your hands directly under your shoulders and your knees directly under your hips. Extend one leg straight back, keeping your knee bent and your foot flexed. Slowly lower your hips towards the ground, feeling a stretch in your quads. Hold this position for 20-30 seconds. Switch legs and repeat the stretch on the other side."
5,alternate heel touchers,근력,1,20,abs,https://v2.exercisedb.io/image/5nYph4eUGNiEdf,waist,,"Lie flat on your back with your knees bent and feet flat on the ground. Extend your arms straight out to the sides, parallel to the ground. Engaging your abs, lift your shoulders off the ground and reach your right hand towards your right heel. Return to the starting position and repeat on the left side, reaching your left hand towards your left heel. Continue alternating sides for the desired number of repetitions."
6,ankle circles,근력,2,20,calves,https://v2.exercisedb.io/image/ivmTcSJsMlXJeK,lower legs,,"Sit on the ground with your legs extended in front of you. Lift one leg off the ground and rotate your ankle in a circular motion. Perform the desired number of circles in one direction, then switch to the other direction. Repeat with the other leg."
7,archer pull up,근력,3,20,lats,https://v2.exercisedb.io/image/LSBkdKcbK4xj8n,back,,"Start by hanging from a pull-up bar with an overhand grip, slightly wider than shoulder-width apart. Engage your core and pull your shoulder blades down and back. As you pull yourself up, bend one arm and bring your elbow towards your side, while keeping the other arm straight. Continue pulling until your chin is above the bar and your bent arm is fully flexed. Lower yourself back down with control, straightening the bent arm and repeating the movement on the other side. Alternate sides with each repetition."
8,archer push up,근력,2,20,pectorals,https://v2.exercisedb.io/image/GSjHZGSiL1VbQ7,chest,,"Start in a push-up position with your hands slightly wider than shoulder-width apart. Extend one arm straight out to the side, parallel to the ground. Lower your body by bending your elbows, keeping your back straight and core engaged. Push back up to the starting position. Repeat on the other side, extending the opposite arm out to the side. Continue alternating sides for the desired number of repetitions."
9,arm slingers hanging bent knee legs,근력,3,20,abs,https://v2.exercisedb.io/image/osybi41Me6RFK2,waist,,"Hang from a pull-up bar with your arms fully extended and your knees bent at a 90-degree angle. Engage your core and lift your knees towards your chest, bringing them as close to your elbows as possible. Slowly lower your legs back down to the starting position. Repeat for the desired number of repetitions."
10,arm slingers hanging straight legs,근력,3,20,abs,https://v2.exercisedb.io/image/yzS2EjySGDLmhh,waist,,"Hang from a pull-up bar with your arms fully extended and your legs straight down. Engage your core and lift your legs up in front of you until they are parallel to the ground. Hold for a moment at the top, then slowly lower your legs back down to the starting position. Repeat for the desired number of repetitions."
11,arms apart circular toe touch (male),근력,2,20,glutes,https://v2.exercisedb.io/image/sGs-MoFgyniLX4,upper legs,,"Stand with your feet shoulder-width apart and arms extended to the sides. Keeping your legs straight, bend forward at the waist and reach down towards your toes with your right hand. As you reach down, simultaneously lift your left leg straight up behind you, maintaining balance. Return to the starting position and repeat the movement with your left hand reaching towards your toes and your right leg lifting up behind you. Continue alternating sides for the desired number of repetitions."
12,arms overhead full sit-up (male),근력,1,20,abs,https://v2.exercisedb.io/image/WzINsIEOqFbBXG,waist,,"Lie flat on your back with your knees bent and feet flat on the ground. Extend your arms overhead, keeping them straight. Engaging your abs, slowly lift your upper body off the ground, curling forward until your torso is upright. Pause for a moment at the top, then slowly lower your upper body back down to the starting position. Repeat for the desired number of repetitions."
13,astride jumps (male),유산소,3,20,cardiovascular system,https://v2.exercisedb.io/image/GzvxMK5EkJ6H43,cardio,,"Stand with your feet shoulder-width apart. Bend your knees and lower your body into a squat position. Jump explosively upwards, extending your legs and arms. While in the air, spread your legs apart and bring your arms out to the sides. Land softly with your feet shoulder-width apart, bending your knees to absorb the impact. Repeat for the desired number of repetitions."
14,back and forth step,근력,2,20,cardiovascular system,https://v2.exercisedb.io/image/akGmnMj1gqgJU3,cardio,,"Stand with your feet shoulder-width apart. Step forward with your right foot, bending your knee and lowering your body into a lunge position. Push off with your right foot and step back to the starting position. Repeat the movement with your left foot, alternating legs with each step. Continue stepping back and forth, maintaining a steady pace. Repeat for the desired duration or number of repetitions."
15,back lever,근력,3,20,upper back,https://v2.exercisedb.io/image/tbNQwmPPyh4Eds,back,,"Start by hanging from a pull-up bar with an overhand grip, hands slightly wider than shoulder-width apart. Engage your core and pull your shoulder blades down and back. Bend your knees and tuck them towards your chest. Slowly lift your legs up, keeping them straight, until your body is parallel to the ground. Hold this position for a few seconds, then slowly lower your legs back down to the starting position. Repeat for the desired number of repetitions."
16,back pec stretch,스트레칭,1,20,lats,https://v2.exercisedb.io/image/RWvKeWqoM6lpAb,back,,"Stand tall with your feet shoulder-width apart. Extend your arms straight out in front of you, parallel to the ground. Cross your arms in front of your body, with your right arm over your left arm. Interlock your fingers and rotate your palms away from your body. Slowly raise your arms up and away from your body, feeling a stretch in your back and chest. Hold the stretch for 15-30 seconds, then release. Repeat on the opposite side."
17,backward jump,유산소,3,20,quads,https://v2.exercisedb.io/image/HHJUonCfKdoEpz,upper legs,,"Stand with your feet shoulder-width apart. Bend your knees slightly and jump backwards, pushing off with both feet. Land softly on the balls of your feet, bending your knees to absorb the impact. Repeat for the desired number of repetitions."
18,balance board,근력,1,20,quads,https://v2.exercisedb.io/image/WDnFXk4aWMCJJi,upper legs,,"Place the balance board on a flat surface. Step onto the balance board with one foot, ensuring it is centered. Slowly shift your weight onto the foot on the balance board, keeping your core engaged. Maintain your balance and stability as you hold the position for a desired amount of time. Repeat the exercise with the other foot."
19,basic toe touch (male),근력,2,20,glutes,https://v2.exercisedb.io/image/ZVrk9i1QyRzTkB,upper legs,,"Stand with your feet shoulder-width apart and your arms by your sides. Bend forward at the waist, keeping your back straight and your knees slightly bent. Reach down towards your toes with your hands, keeping your legs as straight as possible. Pause for a moment at the bottom, then slowly return to the starting position. Repeat for the desired number of repetitions."
20,bear crawl,근력,2,20,cardiovascular system,https://v2.exercisedb.io/image/CU7ulGA569adpS,cardio,,"Start on all fours with your hands directly under your shoulders and your knees directly under your hips. Lift your knees slightly off the ground, keeping your back flat and your core engaged. Move your right hand and left foot forward simultaneously, followed by your left hand and right foot. Continue crawling forward, alternating your hand and foot movements. Maintain a steady pace and keep your core tight throughout the exercise. Continue for the desired distance or time."
21,bench dip (knees bent),근력,2,20,triceps,https://v2.exercisedb.io/image/vkeO-6I-Ehdlpo,upper arms,,"Sit on the edge of a bench or chair with your hands gripping the edge next to your hips. Slide your butt off the bench and straighten your legs in front of you, keeping your heels on the ground. Bend your elbows and lower your body towards the ground, keeping your back close to the bench. Pause for a moment at the bottom, then push yourself back up to the starting position. Repeat for the desired number of repetitions."
22,bench dip on floor,근력,2,20,triceps,https://v2.exercisedb.io/image/UvEBQkLSXKmNCg,upper arms,,"Sit on the edge of a bench or chair with your hands gripping the edge, fingers pointing forward. Slide your butt off the bench, supporting your weight with your hands. Lower your body by bending your elbows until your upper arms are parallel to the floor. Push yourself back up to the starting position by straightening your arms. Repeat for the desired number of repetitions."
23,bench hip extension,근력,2,20,glutes,https://v2.exercisedb.io/image/hbYRkCu265IStj,upper legs,,"Sit on a bench with your back against the bench and your feet flat on the ground. Place your hands on the bench for support. Engage your glutes and hamstrings, then lift your hips off the bench until your body forms a straight line from your knees to your shoulders. Pause for a moment at the top, then slowly lower your hips back down to the starting position. Repeat for the desired number of repetitions."
24,bench pull-ups,근력,3,20,lats,https://v2.exercisedb.io/image/jBAdgotsMCRHN0,back,,"Position yourself under a bar or a sturdy horizontal surface that is at chest height. Grab the bar or surface with an overhand grip, slightly wider than shoulder-width apart. Hang with your arms fully extended and your body straight. Pull your chest towards the bar or surface by squeezing your shoulder blades together and bending your elbows. Continue pulling until your chin is above the bar or surface. Lower yourself back down to the starting position with control. Repeat for the desired number of repetitions."
25,bent knee lying twist (male),근력,1,20,glutes,https://v2.exercisedb.io/image/0zoTwWi25g9GWk,upper legs,,"Lie flat on your back with your knees bent and feet flat on the ground. Extend your arms out to the sides, perpendicular to your body. Keeping your knees together, slowly lower them to one side, aiming to touch the ground with your knees. Pause for a moment, then engage your core and slowly lift your knees back to the starting position. Repeat the movement to the other side. Continue alternating sides for the desired number of repetitions."
26,biceps leg concentration curl,근력,1,20,biceps,https://v2.exercisedb.io/image/lYvRIOG0ks7gce,upper arms,,"Sit on a bench with your legs spread apart and your feet flat on the ground. Hold a dumbbell in one hand and place your elbow on the inside of your thigh, just above the knee. With your palm facing up, curl the dumbbell towards your shoulder while keeping your upper arm stationary. Squeeze your biceps at the top of the movement, then slowly lower the dumbbell back to the starting position. Repeat for the desired number of repetitions, then switch arms."
27,biceps narrow pull-ups,근력,3,20,biceps,https://v2.exercisedb.io/image/v3CNSKHvzpZuXx,upper arms,,"Hang from a pull-up bar with your palms facing towards you and your hands shoulder-width apart. Engage your core and pull yourself up towards the bar, focusing on using your biceps to lift your body. Pause for a moment at the top, then slowly lower yourself back down to the starting position. Repeat for the desired number of repetitions."
28,biceps pull-up,근력,3,20,biceps,https://v2.exercisedb.io/image/4siVDkYEMAO2Gd,upper arms,,"Hang from a pull-up bar with your palms facing away from you and your hands shoulder-width apart. Engage your core and pull yourself up by bending your elbows, bringing your chest towards the bar. Pause at the top of the movement, then slowly lower yourself back down to the starting position. Repeat for the desired number of repetitions."
29,body-up,근력,2,20,triceps,https://v2.exercisedb.io/image/sbZIEWYlYl0Oqw,upper arms,,"Start by placing your hands on a raised surface, such as a bench or parallel bars, with your palms facing down and fingers pointing forward. Extend your legs out in front of you, keeping your heels on the ground and your body straight. Lower your body by bending your elbows, keeping them close to your sides, until your upper arms are parallel to the ground. Pause for a moment, then push through your palms to straighten your arms and lift your body back up to the starting position. Repeat for the desired number of repetitions."
30,bodyweight drop jump squat,유산소,3,20,glutes,https://v2.exercisedb.io/image/-2dzkoOStZiXmI,upper legs,,"Stand with your feet shoulder-width apart. Lower your body into a squat position by bending your knees and pushing your hips back. Jump up explosively, extending your hips, knees, and ankles. While in mid-air, quickly bring your feet together. Land softly on the balls of your feet and immediately drop back into a squat position. Repeat for the desired number of repetitions."
31,bodyweight incline side plank,근력,1,20,abs,https://v2.exercisedb.io/image/YpWud4gyZCYqg4,waist,,"Start by lying on your side with your legs extended and stacked on top of each other. Place your forearm on the ground directly below your shoulder, with your elbow bent at a 90-degree angle. Engage your core and lift your hips off the ground, creating a straight line from your head to your feet. Hold this position for the desired amount of time. Lower your hips back down to the ground and repeat on the other side."
32,bodyweight kneeling triceps extension,근력,2,20,triceps,https://v2.exercisedb.io/image/4Vn7cVWMX6SzC6,upper arms,,"Kneel down on the ground with your knees hip-width apart. Place your hands on the ground in front of you, shoulder-width apart, fingers pointing forward. Extend your legs straight behind you, balancing on your toes and hands, forming a straight line from head to heels. Bend your elbows and lower your upper body towards the ground, keeping your elbows close to your sides. Pause for a moment at the bottom, then push through your hands to straighten your arms and return to the starting position. Repeat for the desired number of repetitions."
33,bodyweight side lying biceps curl,근력,1,20,biceps,https://v2.exercisedb.io/image/S0djC85yaHLxBm,upper arms,,"Lie on your side with your legs extended and your head supported by your arm. Hold your upper arm against your side and bend your elbow to curl your forearm towards your shoulder. Pause for a moment at the top, then slowly lower your forearm back down to the starting position. Repeat for the desired number of repetitions."
34,bodyweight squatting row,근력,1,20,upper back,https://v2.exercisedb.io/image/LayT4WNa4tHO0Q,back,,"Stand with your feet shoulder-width apart, holding onto a sturdy object or suspension trainer with your arms extended. Lower your body into a squat position, keeping your back straight and your knees behind your toes. From the squat position, pull your body up towards the object or suspension trainer, squeezing your shoulder blades together. Pause for a moment at the top, then slowly lower your body back down to the starting position. Repeat for the desired number of repetitions."
35,bodyweight squatting row (with towel),근력,1,20,upper back,https://v2.exercisedb.io/image/KBeY0ACv0XPQOO,back,,"Stand with your feet shoulder-width apart, holding a towel in front of you with your palms facing down. Bend your knees and lower your body into a squat position, keeping your back straight and your chest up. As you lower into the squat, simultaneously pull the towel towards your chest, squeezing your shoulder blades together. Pause for a moment at the bottom of the squat, then slowly return to the starting position while extending your arms. Repeat for the desired number of repetitions."
36,bodyweight standing calf raise,근력,2,20,calves,https://v2.exercisedb.io/image/FwEWEQYUxnabhw,lower legs,,"Stand with your feet shoulder-width apart, toes pointing forward. Place your hands on a wall or stable surface for balance. Slowly raise your heels off the ground, lifting your body weight onto the balls of your feet. Pause for a moment at the top, then slowly lower your heels back down to the starting position. Repeat for the desired number of repetitions."
37,bodyweight standing close-grip one arm row,근력,1,20,upper back,https://v2.exercisedb.io/image/M5RCUNf47k7tAy,back,,"Stand with your feet shoulder-width apart, knees slightly bent, and hold a dumbbell in one hand with a neutral grip. Bend forward at the hips, keeping your back straight and your core engaged. Pull the dumbbell up towards your chest, keeping your elbow close to your body and squeezing your shoulder blades together. Pause for a moment at the top, then slowly lower the dumbbell back down to the starting position. Repeat for the desired number of repetitions, then switch sides."
38,bodyweight standing close-grip row,근력,2,20,upper back,https://v2.exercisedb.io/image/ey7nBdUQPMpPVg,back,,"Stand with your feet shoulder-width apart and knees slightly bent. Bend forward at the waist, keeping your back straight and your core engaged. Extend your arms straight in front of you, gripping the bar or handles with a close grip. Pull the bar or handles towards your body, squeezing your shoulder blades together. Pause for a moment at the top of the movement, then slowly release and return to the starting position. Repeat for the desired number of repetitions."
39,bodyweight standing one arm row,근력,1,20,upper back,https://v2.exercisedb.io/image/Io3cLSzpCI0L09,back,,"Stand with your feet shoulder-width apart, knees slightly bent, and hold a dumbbell in one hand. Bend forward at the hips, keeping your back straight and your core engaged. Let the dumbbell hang straight down in front of you, with your arm fully extended. Pull the dumbbell up towards your chest, keeping your elbow close to your body. Squeeze your shoulder blades together at the top of the movement. Lower the dumbbell back down to the starting position. Repeat for the desired number of repetitions, then switch sides."
40,bodyweight standing one arm row (with towel),근력,1,20,upper back,https://v2.exercisedb.io/image/MBXdF5p6kJAhT0,back,,"Stand with your feet shoulder-width apart, knees slightly bent, and hold a towel with one hand. Bend forward at the hips, keeping your back straight and your core engaged. Pull the towel towards your chest, squeezing your shoulder blades together. Pause for a moment at the top, then slowly lower the towel back to the starting position. Repeat for the desired number of repetitions, then switch to the other arm."
41,bodyweight standing row,근력,2,20,upper back,https://v2.exercisedb.io/image/ij1CJSBoZWXF-F,back,,"Stand with your feet shoulder-width apart and knees slightly bent. Grasp a bar or handles with an overhand grip, palms facing down. Keep your back straight and core engaged. Pull the bar or handles towards your body, squeezing your shoulder blades together. Pause for a moment at the top of the movement. Slowly release and extend your arms back to the starting position. Repeat for the desired number of repetitions."
42,bodyweight standing row (with towel),근력,1,20,upper back,https://v2.exercisedb.io/image/eYrEXv4krQocsU,back,,"Stand with your feet shoulder-width apart and hold a towel in front of you with both hands. Bend your knees slightly and hinge forward at the hips, keeping your back straight. Pull the towel towards your chest, squeezing your shoulder blades together. Pause for a moment at the top, then slowly release the tension and return to the starting position. Repeat for the desired number of repetitions."
43,bottoms-up,근력,1,20,abs,https://v2.exercisedb.io/image/uJM68uWED8V7eV,waist,,"Lie flat on your back with your legs extended and your arms by your sides. Bend your knees and bring them towards your chest, keeping your feet off the ground. Engaging your abs, lift your hips off the ground, bringing your knees towards your head. Pause for a moment at the top, then slowly lower your hips back down to the starting position. Repeat for the desired number of repetitions."
44,box jump down with one leg stabilization,유산소,3,20,calves,https://v2.exercisedb.io/image/mrvkxsiMqQrQIu,lower legs,,"Stand in front of a box or platform with your feet shoulder-width apart. Bend your knees and jump onto the box, landing softly with one foot on the box and the other foot hanging off the edge. Stabilize yourself on the box with the foot that is on it, while keeping the other foot off the ground. Hold this position for a few seconds, engaging your calf muscles to maintain balance. Slowly step down with the foot that is on the box, returning to the starting position. Repeat the exercise with the other leg."
45,bridge - mountain climber (cross body),근력,2,20,abs,https://v2.exercisedb.io/image/0FyhwtAAGu3bx0,waist,,"Start in a high plank position with your hands directly under your shoulders and your body in a straight line. Engage your core and lift your right foot off the ground, bringing your right knee towards your left elbow. Return your right foot to the starting position and repeat the movement with your left foot towards your right elbow. Continue alternating sides, moving at a controlled pace. Keep your hips level and avoid lifting your hips too high or sagging them too low. Maintain a steady breathing pattern throughout the exercise. Repeat for the desired number of repetitions."
46,burpee,유산소,3,20,cardiovascular system,https://v2.exercisedb.io/image/Ouk-Qv9vZOZdwd,cardio,,"Start in a standing position with your feet shoulder-width apart. Lower your body into a squat position by bending your knees and placing your hands on the floor in front of you. Kick your feet back into a push-up position. Perform a push-up, keeping your body in a straight line. Jump your feet back into the squat position. Jump up explosively, reaching your arms overhead. Land softly and immediately lower back into a squat position to begin the next repetition."
47,butt-ups,근력,1,20,abs,https://v2.exercisedb.io/image/IYMUYnpeGnvTIw,waist,,"Lie flat on your back with your knees bent and feet flat on the ground. Place your hands by your sides, palms facing down. Engaging your abs, lift your legs off the ground, bringing your knees towards your chest. At the top of the movement, squeeze your abs and pause for a moment. Slowly lower your legs back down to the starting position. Repeat for the desired number of repetitions."
48,butterfly yoga pose,스트레칭,1,20,adductors,https://v2.exercisedb.io/image/SniB2xypgLYKsv,upper legs,,"Sit on the floor with your legs extended in front of you. Bend your knees and bring the soles of your feet together, allowing your knees to fall out to the sides. Hold onto your ankles or feet with your hands. Sit up tall and lengthen your spine. Gently press your knees down towards the floor, feeling a stretch in your inner thighs. Hold this position for a few breaths. To release, slowly bring your knees back up and extend your legs."
49,calf push stretch with hands against wall,스트레칭,1,20,calves,https://v2.exercisedb.io/image/h5FdrEaBuW2pUr,lower legs,,"Stand facing a wall with your feet hip-width apart. Place your hands against the wall at shoulder height. Step back with one foot, keeping your heel on the ground and your leg straight. Bend your front knee slightly and lean forward, feeling a stretch in your calf. Hold the stretch for 20-30 seconds. Switch legs and repeat the stretch."
