ex_id,name,category,difficulty_level,duration_sec,contraindications,gifUrl,bodyPart,secondaryMuscles,instructions
195,pike-to-cobra push-up,근력,3,20,glutes,https://v2.exercisedb.io/image/o7BFXhNpLqbYyH,upper legs,,"Start in a push-up position with your hands slightly wider than shoulder-width apart and your feet together. Engage your core and lift your hips up towards the ceiling, forming an inverted V shape with your body. Lower your upper body towards the ground by bending your elbows, keeping them close to your body. As you lower down, shift your weight forward and transition into a cobra pose by straightening your arms and lifting your chest up. Reverse the movement by bending your elbows and lowering your chest back down towards the ground. Push through your hands to return to the inverted V position. Continue the movement by lowering your hips back down towards the ground, returning to the starting push-up position. Repeat for the desired number of repetitions."
196,plyo push up,유산소,3,20,pectorals,https://v2.exercisedb.io/image/jvzoBmyMNRDfy6,chest,,"Start in a high plank position with your hands slightly wider than shoulder-width apart. Lower your chest towards the ground by bending your elbows, keeping your body in a straight line. Push explosively off the ground, using your chest muscles to propel your upper body off the ground. Land softly with your hands back in the starting position. Repeat for the desired number of repetitions."
197,posterior step to overhead reach,근력,2,20,abs,https://v2.exercisedb.io/image/f8R1kAESHiGyOZ,waist,,"Stand with your feet hip-width apart and your arms by your sides. Take a step back with your right foot, landing on the ball of your foot. Bend your left knee and lower your body into a lunge position. As you lower into the lunge, simultaneously reach your arms overhead. Pause for a moment at the bottom of the lunge, then return to the starting position by pushing through your left heel and bringing your right foot forward. Repeat the movement on the other side, stepping back with your left foot and bending your right knee. Continue alternating sides for the desired number of repetitions."
198,potty squat,근력,2,20,abs,https://v2.exercisedb.io/image/0vBtOTvrVmNKfc,waist,,"Stand with your feet shoulder-width apart, toes pointing slightly outward. Lower your body down by bending your knees and pushing your hips back as if you were sitting on a chair. Keep your chest up and your back straight throughout the movement. Lower yourself until your thighs are parallel to the ground or as low as you can comfortably go. Pause for a moment at the bottom, then push through your heels to return to the starting position. Repeat for the desired number of repetitions."
199,potty squat with support,근력,1,20,glutes,https://v2.exercisedb.io/image/Mf-kmvgwkr-l0Z,upper legs,,"Stand with your feet shoulder-width apart, toes pointing slightly outward. Hold onto a stable support, such as a chair or wall, for balance. Lower your body down into a squat position by bending your knees and pushing your hips back. Keep your chest up and your back straight throughout the movement. Pause for a moment at the bottom, then push through your heels to return to the starting position. Repeat for the desired number of repetitions."
200,power point plank,근력,1,20,abs,https://v2.exercisedb.io/image/GJL9nN76ce3g3a,waist,,"Start in a high plank position with your hands directly under your shoulders and your body in a straight line from head to toe. Engage your core and squeeze your glutes to maintain a stable position. Lower your body down onto your forearms, one arm at a time, maintaining a straight line from head to toe. Hold this position for the desired amount of time, keeping your core and glutes engaged. To return to the starting position, push through your forearms and lift your body back up into a high plank position. Repeat for the desired number of repetitions."
201,prisoner half sit-up (male),근력,1,20,abs,https://v2.exercisedb.io/image/b1eGzidmNpbjBp,waist,,"Lie flat on your back with your knees bent and feet flat on the ground. Place your hands behind your head with your elbows pointing outwards. Engaging your abs, slowly lift your upper body off the ground, curling forward until your torso is at a 45-degree angle. Pause for a moment at the top, then slowly lower your upper body back down to the starting position. Repeat for the desired number of repetitions."
202,pull up (neutral grip),근력,3,20,lats,https://v2.exercisedb.io/image/g4p0YPaDvnrHTR,back,,"Hang from a pull-up bar with a neutral grip (palms facing each other) and your arms fully extended. Engage your core and squeeze your shoulder blades together. Pull your body up towards the bar by bending your elbows and driving your elbows down towards your hips. Continue pulling until your chin is above the bar. Pause for a moment at the top, then slowly lower your body back down to the starting position with control. Repeat for the desired number of repetitions."
203,pull-up,근력,3,20,lats,https://v2.exercisedb.io/image/bO76Z1G4OoiCkg,back,,"Hang from a pull-up bar with your palms facing away from you and your arms fully extended. Engage your core and squeeze your shoulder blades together. Pull your body up towards the bar by bending your elbows and bringing your chest towards the bar. Pause at the top of the movement, then slowly lower your body back down to the starting position. Repeat for the desired number of repetitions."
204,push and pull bodyweight,근력,2,20,pectorals,https://v2.exercisedb.io/image/A6OXtsigbbyN8g,chest,,"Start in a push-up position with your hands slightly wider than shoulder-width apart and your body in a straight line. Lower your chest towards the ground by bending your elbows, keeping your body straight. Push through your palms to extend your arms and return to the starting position. From the push-up position, pull your chest towards the ground by bending your elbows, keeping your body straight. Push through your palms to extend your arms and return to the starting position. Repeat for the desired number of repetitions."
205,push to run,유산소,2,20,cardiovascular system,https://v2.exercisedb.io/image/kGyXMEXCUJZ403,cardio,,"Start in a push-up position with your hands shoulder-width apart and your body in a straight line. Lower your chest towards the ground by bending your elbows, keeping your body straight. Push through your hands to extend your arms and return to the starting position. Quickly bring one knee towards your chest, then quickly switch and bring the other knee towards your chest. Continue alternating knees as fast as you can while maintaining good form. Continue for the desired duration or number of repetitions."
206,push-up,근력,2,20,pectorals,https://v2.exercisedb.io/image/9MsFCUhdaBISl1,chest,,"Start in a high plank position with your hands slightly wider than shoulder-width apart and your feet together. Engage your core and lower your body towards the ground by bending your elbows, keeping your body in a straight line. Pause for a moment when your chest is just above the ground, then push yourself back up to the starting position by straightening your arms. Repeat for the desired number of repetitions."
207,push-up (wall),근력,2,20,pectorals,https://v2.exercisedb.io/image/3fNM2D1E6h8eDW,chest,,"Stand facing a wall, about arm's length away. Place your hands on the wall at shoulder height, slightly wider than shoulder-width apart. Step back a few feet, keeping your body straight and your feet hip-width apart. Bend your elbows and lower your chest towards the wall, keeping your body in a straight line. Push back up to the starting position, straightening your arms. Repeat for the desired number of repetitions."
208,push-up (wall) v. 2,근력,2,20,pectorals,https://v2.exercisedb.io/image/Ph1r5u60B3vTtO,chest,,"Stand facing a wall, about arm's length away. Place your hands on the wall at shoulder height, slightly wider than shoulder-width apart. Step back with your feet, keeping them hip-width apart. Engage your core and keep your body in a straight line from head to heels. Bend your elbows and lower your chest towards the wall, keeping your body straight. Pause for a moment, then push yourself back to the starting position. Repeat for the desired number of repetitions."
209,push-up inside leg kick,근력,2,20,glutes,https://v2.exercisedb.io/image/c-wIuxTkS7obMe,upper legs,,"Start in a push-up position with your hands slightly wider than shoulder-width apart and your feet together. Lower your body towards the ground by bending your elbows, keeping your back straight and your core engaged. As you push back up, lift one leg off the ground and kick it out to the side, keeping it straight. Lower your leg back down and repeat the push-up, then switch to the other leg. Continue alternating leg kicks with each push-up repetition."
210,push-up on lower arms,근력,2,20,triceps,https://v2.exercisedb.io/image/86oCPd0YvW1Mz2,upper arms,,"Start in a plank position with your forearms on the ground and elbows directly below your shoulders. Engage your core and keep your body in a straight line from head to toe. Lower your chest towards the ground by bending your elbows, keeping them close to your body. Pause for a moment at the bottom, then push yourself back up to the starting position. Repeat for the desired number of repetitions."
211,push-up plus,근력,2,20,pectorals,https://v2.exercisedb.io/image/I8HQ7aJZyjK-QN,chest,,"Start in a high plank position with your hands slightly wider than shoulder-width apart and your body in a straight line from head to heels. Lower your body towards the ground by bending your elbows, keeping them close to your sides. Once your chest is just above the ground, push through your hands to extend your arms and lift your upper body up. At the top of the movement, protract your shoulder blades by pushing your upper back towards the ceiling. Pause for a moment, then reverse the movement by retracting your shoulder blades and lowering your body back down to the starting position. Repeat for the desired number of repetitions."
212,push-up to side plank,근력,1,20,abs,https://v2.exercisedb.io/image/ygtLL3yMsfd9GN,waist,,"Start in a push-up position with your hands shoulder-width apart and your body in a straight line. Lower your body towards the ground by bending your elbows, keeping your core engaged. Push back up to the starting position. Shift your weight onto your left hand and rotate your body to the right, lifting your right arm towards the ceiling. Hold the side plank position for a few seconds, then return to the starting position. Repeat the push-up and side plank on the opposite side. Continue alternating sides for the desired number of repetitions."
213,quads,근력,2,20,quads,https://v2.exercisedb.io/image/KGCXGJ69ngTv6K,upper legs,,Stand with your feet shoulder-width apart. Lower your body by bending your knees and pushing your hips back as if sitting on a chair. Keep your chest up and your back straight. Lower yourself until your thighs are parallel to the ground. Push through your heels to return to the starting position. Repeat for the desired number of repetitions.
214,quarter sit-up,근력,1,20,abs,https://v2.exercisedb.io/image/wTTgnuf2MwZDAY,waist,,"Lie flat on your back with your knees bent and feet flat on the ground. Place your hands behind your head with your elbows pointing outwards. Engaging your abs, slowly lift your upper body off the ground, curling forward until your torso is at a 45-degree angle. Pause for a moment at the top, then slowly lower your upper body back down to the starting position. Repeat for the desired number of repetitions."
215,quick feet v. 2,유산소,2,20,quads,https://v2.exercisedb.io/image/5ZFK9VBKxu0ggN,upper legs,,"Stand with your feet shoulder-width apart and your arms by your sides. Begin by rapidly moving your feet up and down, as if you were running in place. Keep your movements quick and light, focusing on staying on the balls of your feet. Continue for the desired duration or number of repetitions."
216,raise single arm push-up,근력,2,20,pectorals,https://v2.exercisedb.io/image/MCAp3JeMBLGioV,chest,,"Start in a push-up position with your hands slightly wider than shoulder-width apart and your feet together. Extend one arm straight out to the side, parallel to the ground. Lower your body towards the ground by bending your elbows, keeping your back straight and core engaged. Push back up to the starting position, using your chest muscles to lift your body. Repeat with the other arm extended."
217,rear decline bridge,근력,1,20,glutes,https://v2.exercisedb.io/image/Jclzn8UYvKkPga,upper legs,,"Lie on your back with your feet flat on the ground and your knees bent. Place your arms by your sides with your palms facing down. Engage your glutes and hamstrings, and lift your hips off the ground until your body forms a straight line from your knees to your shoulders. Hold this position for a few seconds, then slowly lower your hips back down to the starting position. Repeat for the desired number of repetitions."
218,rear deltoid stretch,스트레칭,1,20,delts,https://v2.exercisedb.io/image/eRTKw8oQP30WZC,shoulders,,"Stand tall with your feet shoulder-width apart. Extend your right arm across your chest, placing your left hand on your right elbow. Gently pull your right arm towards your left shoulder, feeling a stretch in your right shoulder. Hold the stretch for 15-30 seconds, then release. Repeat on the other side."
219,rear pull-up,근력,3,20,lats,https://v2.exercisedb.io/image/FCLINY5buxki-E,back,,"Grab the pull-up bar with an overhand grip, slightly wider than shoulder-width apart. Hang from the bar with your arms fully extended and your body straight. Engage your back muscles and pull your body up towards the bar, keeping your elbows close to your body. Continue pulling until your chin is above the bar. Pause for a moment at the top, then slowly lower your body back down to the starting position. Repeat for the desired number of repetitions."
220,reverse crunch,유산소,1,20,abs,https://v2.exercisedb.io/image/CHdP8JHlAjGiSf,waist,,"Lie flat on your back with your arms extended along your sides. Bend your knees and lift your feet off the ground, bringing your thighs perpendicular to the floor. Contract your abs and curl your hips off the floor, bringing your knees towards your chest. Pause for a moment at the top, then slowly lower your hips back down to the starting position. Repeat for the desired number of repetitions."
221,reverse dip,근력,2,20,triceps,https://v2.exercisedb.io/image/CWMIhiDemD43rf,upper arms,,"Position yourself between two parallel bars with your arms fully extended and your body straight. Lower your body by bending your elbows until your upper arms are parallel to the ground. Pause for a moment, then push yourself back up to the starting position by straightening your arms. Repeat for the desired number of repetitions."
222,reverse grip pull-up,근력,3,20,lats,https://v2.exercisedb.io/image/cbZdnM8ePFs2F4,back,,"Grab the pull-up bar with an underhand grip, hands shoulder-width apart. Hang from the bar with your arms fully extended and your body straight. Engage your back muscles and pull your body up towards the bar, leading with your chest. Continue pulling until your chin is above the bar. Pause for a moment at the top, then slowly lower your body back down to the starting position. Repeat for the desired number of repetitions."
223,reverse hyper on flat bench,근력,1,20,glutes,https://v2.exercisedb.io/image/k5J1S-R8eDzFB5,upper legs,,"Lie face down on a flat bench with your hips at the edge and your legs hanging off the bench. Hold onto the bench for stability. Keeping your legs straight, raise them up towards the ceiling as high as you can. Squeeze your glutes at the top of the movement. Slowly lower your legs back down to the starting position. Repeat for the desired number of repetitions."
224,reverse plank with leg lift,근력,1,20,abs,https://v2.exercisedb.io/image/hPL3XoZlgiStwL,waist,,"Sit on the ground with your legs extended in front of you and your hands resting on the ground behind you, fingers pointing towards your feet. Press through your hands and lift your hips off the ground, coming into a reverse plank position. Engage your core and lift one leg off the ground, extending it straight up towards the ceiling. Hold for a moment, then lower your leg back down. Repeat with the other leg. Continue alternating legs for the desired number of repetitions."
225,ring dips,근력,2,20,triceps,https://v2.exercisedb.io/image/0k68uYx47NuaZQ,upper arms,,Start by hanging from the rings with your arms fully extended and your body straight. Lower your body by bending your elbows until your shoulders are below your elbows. Push yourself back up to the starting position by straightening your arms. Repeat for the desired number of repetitions.
226,rocking frog stretch,스트레칭,1,20,glutes,https://v2.exercisedb.io/image/KupPkwUWbgxpFj,upper legs,,"Start by kneeling on the ground with your knees hip-width apart. Place your hands on the ground in front of you for support. Slowly lean forward, shifting your weight onto your hands and extending your legs behind you. Keep your back straight and engage your glutes as you push your hips back and up towards the ceiling. Hold this position for a few seconds, feeling a stretch in your glutes. Slowly return to the starting position by bending your knees and lowering your hips back down. Repeat for the desired number of repetitions."
227,rocky pull-up pulldown,근력,3,20,lats,https://v2.exercisedb.io/image/7cuYxpy0n9sLX5,back,,"Stand in front of a pull-up bar with your feet shoulder-width apart. Reach up and grab the bar with an overhand grip, slightly wider than shoulder-width apart. Hang from the bar with your arms fully extended and your body straight. Engage your back muscles and pull your body up towards the bar, leading with your chest. Pause for a moment at the top, then slowly lower your body back down to the starting position. Repeat for the desired number of repetitions."
228,run,유산소,2,20,cardiovascular system,https://v2.exercisedb.io/image/hrAa8vzKcKMB2W,cardio,,"Start by standing upright with your feet hip-width apart. Engage your core and keep your upper body relaxed. Begin jogging in place, lifting your knees up towards your chest and landing softly on the balls of your feet. Maintain a steady pace and continue jogging for the desired duration or distance. Remember to breathe deeply and maintain good posture throughout the exercise."
229,run (equipment),유산소,2,20,cardiovascular system,https://v2.exercisedb.io/image/w6TdZTz6jyj5Er,cardio,,"Start by standing upright with your feet hip-width apart. Engage your core and keep your upper body relaxed. Begin jogging in place, lifting your knees up towards your chest and landing softly on the balls of your feet. Maintain a steady pace and continue jogging for the desired duration or distance. Remember to breathe deeply and maintain good posture throughout the exercise."
230,runners stretch,유산소,1,20,hamstrings,https://v2.exercisedb.io/image/dA2RZTTki9RNZc,upper legs,,"Stand with your feet hip-width apart. Take a step forward with your right foot, keeping your left foot planted. Bend your right knee and lower your body down, keeping your left leg straight. Place your hands on your right thigh for support. Hold the stretch for 20-30 seconds, then switch sides and repeat."
231,russian twist,근력,1,20,abs,https://v2.exercisedb.io/image/hg4EMibfvBZEYz,waist,,"Sit on the ground with your knees bent and feet flat on the floor. Lean back slightly while keeping your back straight and your core engaged. Hold your hands together in front of your chest or hold a weight if desired. Lift your feet off the ground, balancing on your sit bones. Twist your torso to the right, bringing your hands or weight towards the right side of your body. Pause for a moment, then twist your torso to the left, bringing your hands or weight towards the left side of your body. Continue alternating sides for the desired number of repetitions."
232,scapula dips,근력,2,20,traps,https://v2.exercisedb.io/image/9YHzd0IKZHjWc3,back,,"Start by standing with your feet shoulder-width apart and your arms extended in front of you. Bend your knees slightly and hinge forward at the hips, keeping your back straight. Lower your body by bending your elbows and retracting your shoulder blades, as if you are trying to squeeze a pencil between them. Pause for a moment at the bottom, then push through your hands to extend your elbows and return to the starting position. Repeat for the desired number of repetitions."
233,scapula push-up,근력,2,20,serratus anterior,https://v2.exercisedb.io/image/C1-F3Jt-13IaIt,chest,,"Start in a high plank position with your hands directly under your shoulders and your body in a straight line. Lower your chest towards the ground, keeping your elbows close to your body. As you lower, squeeze your shoulder blades together and push your chest forward. Pause for a moment at the bottom, then push back up to the starting position. Repeat for the desired number of repetitions."
234,scapular pull-up,근력,3,20,traps,https://v2.exercisedb.io/image/WBgt2EzoQMUeHH,back,,"Start by hanging from a pull-up bar with your palms facing away from you and your arms fully extended. Retract your shoulder blades by pulling them down and back. Engage your back muscles and pull your body up towards the bar, focusing on squeezing your shoulder blades together. Pause for a moment at the top of the movement, then slowly lower your body back down to the starting position. Repeat for the desired number of repetitions."
235,scissor jumps (male),유산소,3,20,cardiovascular system,https://v2.exercisedb.io/image/3FmT4YfIN6Ynbt,cardio,,"Stand with your feet shoulder-width apart. Jump off the ground and simultaneously cross your right leg in front of your left leg. As you land, quickly switch legs, crossing your left leg in front of your right leg. Continue alternating legs and jumping as quickly as possible. Repeat for the desired number of repetitions."
236,seated calf stretch (male),스트레칭,1,20,calves,https://v2.exercisedb.io/image/LMbVbz35RTzTWa,lower legs,,"Sit on the edge of a chair or bench with your feet flat on the ground. Extend one leg straight out in front of you, keeping your heel on the ground. Lean forward slightly, feeling a stretch in your calf muscle. Hold the stretch for 20-30 seconds. Switch legs and repeat the stretch."
237,seated glute stretch,스트레칭,1,20,glutes,https://v2.exercisedb.io/image/BeLMEwrrqJ0-O0,upper legs,,"Sit on the ground with your legs extended in front of you. Bend your right knee and cross your right ankle over your left thigh. Place your right hand on the ground behind you for support. With your left hand, gently press down on your right knee to deepen the stretch. Hold the stretch for 30 seconds to 1 minute. Switch sides and repeat."
238,seated leg raise,근력,2,20,abs,https://v2.exercisedb.io/image/fBlO7Anbhp-Ops,waist,,"Sit on a flat bench with your back straight and your feet flat on the ground. Place your hands on the sides of the bench for support. Keeping your legs straight, slowly raise them up in front of you until they are parallel to the ground. Pause for a moment at the top, then slowly lower your legs back down to the starting position. Repeat for the desired number of repetitions."
239,seated lower back stretch,스트레칭,1,20,lats,https://v2.exercisedb.io/image/gzjtZ5tPzmHRqh,back,,"Sit on the edge of a chair with your feet flat on the ground. Place your hands on your thighs or on the sides of the chair for support. Slowly lean forward from your hips, keeping your back straight. Feel the stretch in your lower back and hold for 20-30 seconds. Slowly return to the starting position and repeat for the desired number of repetitions."
240,seated piriformis stretch,스트레칭,1,20,glutes,https://v2.exercisedb.io/image/8DcjA5MZH2J1bf,upper legs,,"Sit on the ground with your legs extended in front of you. Bend your right knee and place your right foot on the outside of your left knee. Place your left elbow on the outside of your right knee and gently twist your torso to the right. Hold the stretch for 20-30 seconds, then switch sides and repeat."
241,seated side crunch (wall),유산소,2,20,abs,https://v2.exercisedb.io/image/4vcoYAquUxxYZ9,waist,,"Sit on the floor with your back against a wall and your legs extended in front of you. Bend your knees and place your feet flat on the floor, hip-width apart. Place your hands behind your head with your elbows pointing outwards. Engage your abs and lean to one side, bringing your elbow towards your hip. Pause for a moment, then return to the starting position. Repeat on the other side. Continue alternating sides for the desired number of repetitions."
242,seated wide angle pose sequence,스트레칭,1,20,hamstrings,https://v2.exercisedb.io/image/kw9N0PAyu-FHSU,upper legs,,"Sit on the ground with your legs extended in a wide angle. Flex your feet and engage your quadriceps. Place your hands on the ground behind you for support. Keeping your back straight, lean forward from your hips. Continue leaning forward until you feel a stretch in your hamstrings. Hold this position for a few breaths. Slowly release the stretch and return to the starting position. Repeat for the desired number of repetitions."
